{"admission":{"path":"works/manga-press-specimen/admission-001.json","sha256":"480d1565fe4424a6dcd8c78f2a87ef98b2ad36bb2fdd252ad999faac8deae2c5"},"allowedAdaptationScope":["pictured-source test staging proposals; motion requires independent editorial admission"],"authority":{"editorialAdmission":false,"houseRelease":false,"render":false,"staging":false},"editionAdmission":{"path":"works/manga-press-specimen/manga/001/admission-001.json","sha256":"c2a27fdf9bc70c865375f4d13eb5117caa0985e79d5c50f85dc116b018163f88"},"editionHash":"e5e4a93558c64eb8ed89f1485e501eccdb9b201abfd5f3d9160414cd22cb6663","editionId":"lemonpress:manga-press-synthetic-001:manga-001","externalEditorialAuthorityReference":null,"grants":{"derivativeReuse":true,"motionAdaptation":true,"pixelHarvest":false,"pixelReuse":true,"publicationReuse":false,"synthesizedSound":false},"handoffHash":"dd9b21083a4781e619e95a9a2f7cfdde728d570e23ea57ec22e868ab5778c42a","issueId":"lemonpress:manga-press-synthetic-001:issue-001","laws":["FORM != SOURCE","EDITION != SOURCE","PAGE ORDER != CANON AUTHORITY","PAGE != PANEL MAP","PANEL MAP != SEMANTIC UNDERSTANDING","IMAGE IDENTITY != CHARACTER IDENTITY","PRINT ADMISSION != PERFORMANCE ADMISSION","PUBLICATION != ANIMATION","HANDOFF != RENDER","HANDOFF != STAGING","HANDOFF != EDITORIAL ADMISSION","HANDOFF != PIXEL HARVEST AUTHORITY UNLESS EXPLICIT","PUBLICATION CONTEXT != STAGING DECISION","PRESS != HARVESTER","PUBLICATION PAGE != PARTS DRAWER","IMPOSITION PLAN != PRINTER ACCEPTANCE","PROOF != PUBLICATION","PRINT DESCENDANT != PERFORMANCE DESCENDANT","PERFORMANCE DESCENDANT != PRINT SOURCE","SIBLING DESCENDANTS MAY DIFFER","RETURN != PUBLICATION","RENDER EXISTS != HOUSE RELEASE","DESCENDANT != ANCESTOR","THE WORDS MAY MUTATE. THE RELATION MAY CARRY."],"orderingContext":{"placements":[{"face":"recto","leaf":1,"pageId":"page-01","parent":{"editionHash":"e5e4a93558c64eb8ed89f1485e501eccdb9b201abfd5f3d9160414cd22cb6663","editionId":"lemonpress:manga-press-synthetic-001:manga-001","issueId":"lemonpress:manga-press-synthetic-001:issue-001","pageHash":"bdd60cbab33e9cbaf77c3384a0fc15dc2b32075a9315375e1733dd2af0e5963f","pageId":"page-01","sourceImageSha256":"2e9218a9e18e8b2d4001ee8434457ae6ab959c9f52fc8b97f5a227777c9faf68","workId":"lemonpress:manga-press-synthetic-001"},"parity":"odd","placementId":"place-01","position":1,"repeatOf":null,"side":"right"},{"face":"verso","leaf":1,"pageId":"page-02","parent":{"editionHash":"e5e4a93558c64eb8ed89f1485e501eccdb9b201abfd5f3d9160414cd22cb6663","editionId":"lemonpress:manga-press-synthetic-001:manga-001","issueId":"lemonpress:manga-press-synthetic-001:issue-001","pageHash":"95d2411cbadb30e9644a1ee1381dd9113cd0bf0748775649b2d9d5aa48ba4749","pageId":"page-02","sourceImageSha256":"723a510b2d6dd2fad4da48d8642c7232de2a9e6f755f0e0b7af9c8ee595944c5","workId":"lemonpress:manga-press-synthetic-001"},"parity":"even","placementId":"place-02","position":2,"repeatOf":null,"side":"left"},{"face":"recto","leaf":2,"pageId":"page-03","parent":{"editionHash":"e5e4a93558c64eb8ed89f1485e501eccdb9b201abfd5f3d9160414cd22cb6663","editionId":"lemonpress:manga-press-synthetic-001:manga-001","issueId":"lemonpress:manga-press-synthetic-001:issue-001","pageHash":"34c993228f0ee56c953f53d4882112ce5e77877a42b0c9928cdde5a599860111","pageId":"page-03","sourceImageSha256":"31065a32f761a0890d6046233f41609575cdf2f40e5788fe85a8697ec89e520c","workId":"lemonpress:manga-press-synthetic-001"},"parity":"odd","placementId":"place-03","position":3,"repeatOf":null,"side":"right"},{"face":"verso","leaf":2,"pageId":"page-04","parent":{"editionHash":"e5e4a93558c64eb8ed89f1485e501eccdb9b201abfd5f3d9160414cd22cb6663","editionId":"lemonpress:manga-press-synthetic-001:manga-001","issueId":"lemonpress:manga-press-synthetic-001:issue-001","pageHash":"935a43bc81be3bd17905ac5b064a59823cb5e7204c9e6f051369f2b412984c8d","pageId":"page-04","sourceImageSha256":"55da5ac3eb66d42a654f0a1be80ac71a219c9089dcb51f059ecc8ea2cd64847f","workId":"lemonpress:manga-press-synthetic-001"},"parity":"even","placementId":"place-04","position":4,"repeatOf":null,"side":"left"},{"face":"recto","leaf":3,"pageId":"page-05","parent":{"editionHash":"e5e4a93558c64eb8ed89f1485e501eccdb9b201abfd5f3d9160414cd22cb6663","editionId":"lemonpress:manga-press-synthetic-001:manga-001","issueId":"lemonpress:manga-press-synthetic-001:issue-001","pageHash":"a437492d2ac70155ae145448c442523492dc03b5f66dc401a35cb9ea52bb7dbe","pageId":"page-05","sourceImageSha256":"36a9e87799977330d112f35dfd3567b39eda66a8c418532cf6cc8ef520dd5168","workId":"lemonpress:manga-press-synthetic-001"},"parity":"odd","placementId":"place-05","position":5,"repeatOf":null,"side":"right"},{"face":"verso","leaf":3,"pageId":"page-06","parent":{"editionHash":"e5e4a93558c64eb8ed89f1485e501eccdb9b201abfd5f3d9160414cd22cb6663","editionId":"lemonpress:manga-press-synthetic-001:manga-001","issueId":"lemonpress:manga-press-synthetic-001:issue-001","pageHash":"123912056693b81263c1f7cae4f8500f518c9f475597ae6ec151abcf087c44bf","pageId":"page-06","sourceImageSha256":null,"workId":"lemonpress:manga-press-synthetic-001"},"parity":"even","placementId":"place-06","position":6,"repeatOf":null,"side":"left"},{"face":"recto","leaf":4,"pageId":"page-07","parent":{"editionHash":"e5e4a93558c64eb8ed89f1485e501eccdb9b201abfd5f3d9160414cd22cb6663","editionId":"lemonpress:manga-press-synthetic-001:manga-001","issueId":"lemonpress:manga-press-synthetic-001:issue-001","pageHash":"3c360d9174ffaa6a00503a40ba72d56dcb172d6d1a0ab66b72ef7154e5bfe0f9","pageId":"page-07","sourceImageSha256":"728d9855234fa37ee5422abbb5f6a1a52a5a9e935c77f085a71fe588f77457f8","workId":"lemonpress:manga-press-synthetic-001"},"parity":"odd","placementId":"place-07","position":7,"repeatOf":null,"side":"right"},{"face":"verso","leaf":4,"pageId":"page-08","parent":{"editionHash":"e5e4a93558c64eb8ed89f1485e501eccdb9b201abfd5f3d9160414cd22cb6663","editionId":"lemonpress:manga-press-synthetic-001:manga-001","issueId":"lemonpress:manga-press-synthetic-001:issue-001","pageHash":"f153beb239714f1336fa4c1b32f816a4d133896b211e618de6b37ce15525cb39","pageId":"page-08","sourceImageSha256":"8e4b76f3ab55a8c58574358baf8d6ff1c2c80d64e5c3ee519318bb616b47fbe5","workId":"lemonpress:manga-press-synthetic-001"},"parity":"even","placementId":"place-08","position":8,"repeatOf":null,"side":"left"}],"readingDirection":"ltr","spreads":[{"placements":["place-04","place-05"],"spreadId":"spread-001"}]},"pages":[{"dialogueCaptionReferences":[{"path":"works/manga-press-specimen/source-001.json","sha256":"498f26aa8da6c7a1269f11a8836eb77e4c1e1f7ba1597a19935ddb919a95f595"}],"grants":{"derivativeReuse":true,"motionAdaptation":true,"pixelHarvest":false,"pixelReuse":true,"publicationReuse":false,"synthesizedSound":false},"identity":{"editionHash":"e5e4a93558c64eb8ed89f1485e501eccdb9b201abfd5f3d9160414cd22cb6663","editionId":"lemonpress:manga-press-synthetic-001:manga-001","issueId":"lemonpress:manga-press-synthetic-001:issue-001","pageHash":"a437492d2ac70155ae145448c442523492dc03b5f66dc401a35cb9ea52bb7dbe","pageId":"page-05","sourceImageSha256":"36a9e87799977330d112f35dfd3567b39eda66a8c418532cf6cc8ef520dd5168","workId":"lemonpress:manga-press-synthetic-001"},"internalSemantics":"unknown","narrativeReferences":[{"path":"works/manga-press-specimen/source-001.json","sha256":"498f26aa8da6c7a1269f11a8836eb77e4c1e1f7ba1597a19935ddb919a95f595"}],"panelMap":null,"rightsSource":{"path":"works/manga-press-specimen/admission-001.json","sha256":"480d1565fe4424a6dcd8c78f2a87ef98b2ad36bb2fdd252ad999faac8deae2c5"},"sourceImage":{"path":"works/manga-press-specimen/manga/001/pixels/page-05.png","sha256":"36a9e87799977330d112f35dfd3567b39eda66a8c418532cf6cc8ef520dd5168"}}],"schema":"lemonpress/manga-performance-handoff/v0","source":{"path":"works/manga-press-specimen/source-001.json","sha256":"498f26aa8da6c7a1269f11a8836eb77e4c1e1f7ba1597a19935ddb919a95f595"},"targetVocabulary":{"admission":"haunted-blender/editorial-admission/v1","narrativeSource":"haunted-blender/narrative-particular-source/v1","ownedPixels":"haunted-blender/owned-pixel-donor/v1","pageSource":"haunted-blender/page-source/v1","plan":"haunted-blender/particular-performance-plan/v1","proposal":"haunted-blender/staging-proposal/v1"},"workId":"lemonpress:manga-press-synthetic-001"}